{
  "schemaVersion": "1.0.0",
  "company": {
    "companyNumber": "AB123456"
  },
  "generatedAt": "2026-06-21T11:00:00+01:00",
  "sections": {
    "company_profile": {
      "status": "complete",
      "facts": [
        {
          "id": "company-profile.snapshot",
          "type": "company.profile_snapshot",
          "origin": "source",
          "value": {
            "active": true,
            "jurisdiction": "england-wales",
            "previousNames": [],
            "sicCodes": ["62012", "70229"],
            "lastAccounts": null
          },
          "evidence": [
            {
              "sourceUri": "https://api.company-information.service.gov.uk/company/AB123456",
              "retrievedAt": "2026-06-21T09:59:59Z",
              "payloadSha256": "bbbbbbbbbbbbbbbbbbbbbbbbbbbbbbbbbbbbbbbbbbbbbbbbbbbbbbbbbbbbbbbb"
            }
          ]
        },
        {
          "id": "company-profile.is-active",
          "type": "company.is_active",
          "origin": "derived",
          "ruleId": "rule.company-active-status.v1",
          "value": true,
          "evidence": [
            {
              "sourceUri": "https://api.company-information.service.gov.uk/company/AB123456",
              "retrievedAt": "2026-06-21T09:59:59Z",
              "payloadSha256": "bbbbbbbbbbbbbbbbbbbbbbbbbbbbbbbbbbbbbbbbbbbbbbbbbbbbbbbbbbbbbbbb"
            }
          ]
        }
      ],
      "warnings": [],
      "errors": []
    },
    "filing_history": {
      "status": "partial",
      "facts": [
        {
          "id": "filing-history.latest-filing",
          "type": "filing.latest",
          "origin": "source",
          "value": {
            "category": "accounts",
            "pages": 14
          },
          "evidence": [
            {
              "sourceUri": "https://api.company-information.service.gov.uk/company/AB123456/filing-history",
              "retrievedAt": "2026-06-21T10:00:00Z",
              "payloadSha256": "cccccccccccccccccccccccccccccccccccccccccccccccccccccccccccccccc"
            }
          ]
        }
      ],
      "warnings": [
        "Only the first Companies House filing-history page was retrieved."
      ],
      "errors": []
    },
    "insolvency": {
      "status": "unavailable",
      "facts": [],
      "warnings": [],
      "errors": [
        "Companies House insolvency endpoint returned a transient upstream error."
      ]
    },
    "charges": {
      "status": "not_applicable",
      "facts": [],
      "warnings": [
        "Companies House reports no charge data applicable to this company snapshot."
      ],
      "errors": []
    }
  },
  "sourceAttribution": {
    "provider": "Companies House",
    "sourceUri": "https://api.company-information.service.gov.uk/",
    "licenceUri": "https://developer.company-information.service.gov.uk/developer-guidelines",
    "dataTermsUri": "https://developer.company-information.service.gov.uk/api/docs/",
    "retrievalCaveat": "Companies House data is retrieved at the generatedAt timestamp and may change after retrieval.",
    "nonAffiliationStatement": "This dossier is independently generated and is not affiliated with Companies House."
  }
}
